{
  "$schema": "https://json-schema.org/draft/2020-12/schema",
  "$id": "https://echoforge.local/schemas/minutes.schema.json",
  "title": "Minutes",
  "type": "object",
  "required": ["recordingId", "profile", "summary", "sections"],
  "properties": {
    "recordingId": {
      "type": "string"
    },
    "profile": {
      "type": "string"
    },
    "summary": {
      "type": "string"
    },
    "sections": {
      "type": "object",
      "properties": {
        "chapters": {
          "type": "array",
          "items": {
            "type": "object",
            "required": ["title", "summary"],
            "properties": {
              "title": {
                "type": "string"
              },
              "summary": {
                "type": "string"
              }
            },
            "additionalProperties": false
          }
        },
        "decisions": {
          "type": "array",
          "items": {
            "type": "string"
          }
        },
        "todos": {
          "type": "array",
          "items": {
            "type": "object",
            "required": ["text"],
            "properties": {
              "text": {
                "type": "string"
              },
              "owner": {
                "type": "string"
              },
              "dueAt": {
                "type": "string",
                "format": "date-time"
              }
            },
            "additionalProperties": false
          }
        },
        "quotes": {
          "type": "array",
          "items": {
            "type": "object",
            "required": ["text"],
            "properties": {
              "text": {
                "type": "string"
              },
              "speaker": {
                "type": "string"
              },
              "timestamp": {
                "type": "number",
                "minimum": 0
              }
            },
            "additionalProperties": false
          }
        },
        "links": {
          "type": "array",
          "items": {
            "type": "object",
            "required": ["url"],
            "properties": {
              "label": {
                "type": "string"
              },
              "url": {
                "type": "string",
                "format": "uri"
              }
            },
            "additionalProperties": false
          }
        },
        "glossary": {
          "type": "array",
          "items": {
            "type": "object",
            "required": ["term", "definition"],
            "properties": {
              "term": {
                "type": "string"
              },
              "definition": {
                "type": "string"
              }
            },
            "additionalProperties": false
          }
        }
      },
      "additionalProperties": true
    },
    "sourceArtifacts": {
      "type": "object",
      "properties": {
        "transcriptContentRole": {
          "type": "string",
          "enum": ["machine_transcript"]
        },
        "transcriptProviderKind": {
          "type": "string"
        },
        "chapterSourceContentRole": {
          "type": ["string", "null"],
          "enum": ["machine_transcript", null]
        },
        "transcriptPath": {
          "type": "string"
        },
        "transcriptMarkdownPath": {
          "type": "string"
        },
        "transcriptMarkdownRole": {
          "type": "string",
          "enum": ["human_readable_transcript"]
        },
        "chaptersPath": {
          "type": "string"
        }
      },
      "additionalProperties": false
    }
  },
  "additionalProperties": false
}
