{
  "recordingId": "rec_1773490216_7b166148",
  "profile": "work_meeting",
  "summary": "Key decision: 我们先把这周最关键的需求收敛下来，然后安排下个迭代。 Next action: 可以，我来整理一下优先级和负责人，今天晚上同步到文档里。",
  "sections": {
    "chapters": [
      {
        "title": "我们先把这周最关键的需求收敛下来，然后安排下个迭...",
        "summary": "我们先把这周最关键的需求收敛下来，然后安排下个迭代。 可以，我来整理一下优先级和负责人，今天晚上同步到文档里。"
      }
    ],
    "decisions": [
      "我们先把这周最关键的需求收敛下来，然后安排下个迭代。"
    ],
    "quotes": [],
    "links": [],
    "todos": [
      {
        "text": "可以，我来整理一下优先级和负责人，今天晚上同步到文档里。",
        "owner": "Speaker 2",
        "dueAt": "2026-03-15T20:00:00.000Z"
      }
    ]
  },
  "sourceArtifacts": {
    "transcriptContentRole": "machine_transcript",
    "transcriptProviderKind": "host_agent_multimodal_audio_understanding",
    "chapterSourceContentRole": "machine_transcript",
    "transcriptPath": "state/runs/run_rec_1773490216_7b166148_mmur9kwx99b1/transcript.json",
    "transcriptMarkdownPath": "state/runs/run_rec_1773490216_7b166148_mmur9kwx99b1/transcript.md",
    "chaptersPath": "state/runs/run_rec_1773490216_7b166148_mmur9kwx99b1/chapters.json",
    "transcriptMarkdownRole": "human_readable_transcript"
  }
}
