{
  "recordingId": "rec_1773813843-69ca8714-7e28-4b1d-bb82-06b2bfbdd1c9_mmwusq5y",
  "profile": "general",
  "summary": "Jerry 正在测试 EchoForge 的音频理解和 skill 触发流程，确认模型是否能正确处理音频并生成结构化工件。",
  "sections": {
    "chapters": [
      {
        "title": "测试一下调用吧，用这个音频文件",
        "summary": "测试一下调用吧，用这个音频文件。"
      }
    ],
    "decisions": [],
    "quotes": [
      {
        "text": "测试一下调用吧，用这个音频文件。",
        "speaker": "Jerry",
        "timestamp": 0
      }
    ],
    "links": []
  },
  "sourceArtifacts": {
    "transcriptContentRole": "machine_transcript",
    "transcriptProviderKind": "host_agent_multimodal_audio_understanding",
    "chapterSourceContentRole": "machine_transcript",
    "transcriptPath": "state/runs/run_rec_1773813843-69ca8714-7e28-4b1d-bb82-06b2bfbdd1c9_mmwusq5y_mmwv2gg3cf54/transcript.json",
    "transcriptMarkdownPath": "state/runs/run_rec_1773813843-69ca8714-7e28-4b1d-bb82-06b2bfbdd1c9_mmwusq5y_mmwv2gg3cf54/transcript.md",
    "chaptersPath": "state/runs/run_rec_1773813843-69ca8714-7e28-4b1d-bb82-06b2bfbdd1c9_mmwusq5y_mmwv2gg3cf54/chapters.json",
    "transcriptMarkdownRole": "human_readable_transcript"
  }
}
