{
  "recordingId": "rec_demo_mmu9v43a",
  "profile": "lecture",
  "summary": "Placeholder transcript for demo. Replace this stub with a real ASR backend.",
  "sections": {
    "chapters": [
      {
        "title": "Placeholder transcript f...",
        "summary": "Placeholder transcript for demo. Replace this stub with a real ASR backend."
      }
    ],
    "quotes": [
      {
        "text": "Placeholder transcript for demo.",
        "speaker": "speaker_1",
        "timestamp": 0
      },
      {
        "text": "Replace this stub with a real ASR backend.",
        "speaker": "speaker_2",
        "timestamp": 12
      }
    ],
    "links": [],
    "glossary": [
      {
        "term": "ASR",
        "definition": "Mentioned in the machine transcript context."
      },
      {
        "term": "backend",
        "definition": "Mentioned in the machine transcript context."
      },
      {
        "term": "demo",
        "definition": "Mentioned in the machine transcript context."
      },
      {
        "term": "for",
        "definition": "Mentioned in the machine transcript context."
      },
      {
        "term": "Placeholder",
        "definition": "Mentioned in the machine transcript context."
      },
      {
        "term": "real",
        "definition": "Mentioned in the machine transcript context."
      },
      {
        "term": "Replace",
        "definition": "Mentioned in the machine transcript context."
      },
      {
        "term": "stub",
        "definition": "Mentioned in the machine transcript context."
      },
      {
        "term": "this",
        "definition": "Mentioned in the machine transcript context."
      },
      {
        "term": "transcript",
        "definition": "Mentioned in the machine transcript context."
      }
    ]
  },
  "sourceArtifacts": {
    "transcriptContentRole": "machine_transcript",
    "transcriptProviderKind": "legacy_audio_understanding",
    "chapterSourceContentRole": "machine_transcript",
    "transcriptPath": "state/runs/rec_demo_mmu9v43a/transcript.json",
    "transcriptMarkdownPath": "state/runs/rec_demo_mmu9v43a/transcript.md",
    "chaptersPath": "state/runs/rec_demo_mmu9v43a/chapters.json",
    "transcriptMarkdownRole": "human_readable_transcript"
  }
}
