{
  "recordingId": "rec_file-41-d281ac01-b9be-4e8a-abac-5b3d89c4e893_mmwvatgl",
  "profile": "general",
  "summary": "用户对 EchoForge 进行第二次音频调用测试，内容涉及对功能的确认和下一步动作的简短指令。",
  "sections": {
    "chapters": [
      {
        "title": "这次用这个文件试一下",
        "summary": "这次用这个文件试一下。"
      }
    ],
    "decisions": [],
    "quotes": [],
    "links": []
  },
  "sourceArtifacts": {
    "transcriptContentRole": "machine_transcript",
    "transcriptProviderKind": "host_agent_multimodal_audio_understanding",
    "chapterSourceContentRole": "machine_transcript",
    "transcriptPath": "state/runs/run_rec_file-41-d281ac01-b9be-4e8a-abac-5b3d89c4e893_mmwvatgl_mmwvaxn279d6/transcript.json",
    "transcriptMarkdownPath": "state/runs/run_rec_file-41-d281ac01-b9be-4e8a-abac-5b3d89c4e893_mmwvatgl_mmwvaxn279d6/transcript.md",
    "chaptersPath": "state/runs/run_rec_file-41-d281ac01-b9be-4e8a-abac-5b3d89c4e893_mmwvatgl_mmwvaxn279d6/chapters.json",
    "transcriptMarkdownRole": "human_readable_transcript"
  }
}
