{
  "recordingId": "rec_1773490216_7b166148",
  "profile": "lecture",
  "summary": "讨论了项目优先级和后续行动。",
  "sections": {
    "chapters": [
      {
        "title": "我们先把这周最关键的需求收敛下来，然后安排下个迭...",
        "summary": "我们先把这周最关键的需求收敛下来，然后安排下个迭代。 可以，我来整理一下优先级和负责人，今天晚上同步到文档里。"
      }
    ],
    "quotes": [
      {
        "text": "可以，我来整理一下优先级和负责人，今天晚上同步到文档里。",
        "speaker": "Speaker 2",
        "timestamp": 18
      },
      {
        "text": "我们先把这周最关键的需求收敛下来，然后安排下个迭代。",
        "speaker": "Speaker 1",
        "timestamp": 0
      }
    ],
    "links": [],
    "glossary": []
  },
  "sourceArtifacts": {
    "transcriptContentRole": "machine_transcript",
    "transcriptProviderKind": "host_agent_multimodal_audio_understanding",
    "chapterSourceContentRole": "machine_transcript",
    "transcriptPath": "state/runs/run_rec_1773490216_7b166148_mmvl3rjta07a/transcript.json",
    "transcriptMarkdownPath": "state/runs/run_rec_1773490216_7b166148_mmvl3rjta07a/transcript.md",
    "chaptersPath": "state/runs/run_rec_1773490216_7b166148_mmvl3rjta07a/chapters.json",
    "transcriptMarkdownRole": "human_readable_transcript"
  }
}
