{
  "recordingId": "rec_1773490216_7b166148",
  "profile": "lecture",
  "summary": "讨论了项目优先级和后续行动。",
  "sections": {
    "chapters": [
      {
        "title": "我们先把这周最关键的需求收敛下来，然后安排下个迭...",
        "summary": "我们先把这周最关键的需求收敛下来，然后安排下个迭代。 可以，我来整理一下优先级和负责人，今天晚上同步到文档里。"
      }
    ],
    "quotes": [
      {
        "text": "可以，我来整理一下优先级和负责人，今天晚上同步到文档里。",
        "speaker": "Speaker 2",
        "timestamp": 18
      },
      {
        "text": "我们先把这周最关键的需求收敛下来，然后安排下个迭代。",
        "speaker": "Speaker 1",
        "timestamp": 0
      }
    ],
    "links": [],
    "glossary": [
      {
        "term": "book or paper titles",
        "definition": "Mentioned in the machine transcript context."
      },
      {
        "term": "named concepts",
        "definition": "Mentioned in the machine transcript context."
      },
      {
        "term": "quoted phrases",
        "definition": "Mentioned in the machine transcript context."
      },
      {
        "term": "technical terms",
        "definition": "Mentioned in the machine transcript context."
      },
      {
        "term": "今天晚上同步到文",
        "definition": "Mentioned in the machine transcript context."
      },
      {
        "term": "可以",
        "definition": "Mentioned in the machine transcript context."
      },
      {
        "term": "我们先把这周最关",
        "definition": "Mentioned in the machine transcript context."
      },
      {
        "term": "我来整理一下优先",
        "definition": "Mentioned in the machine transcript context."
      },
      {
        "term": "档里",
        "definition": "Mentioned in the machine transcript context."
      },
      {
        "term": "然后安排下个迭代",
        "definition": "Mentioned in the machine transcript context."
      }
    ]
  },
  "sourceArtifacts": {
    "transcriptContentRole": "machine_transcript",
    "transcriptProviderKind": "host_agent_multimodal_audio_understanding",
    "chapterSourceContentRole": "machine_transcript",
    "transcriptPath": "state/runs/run_rec_1773490216_7b166148_mmvg4vsyc805/transcript.json",
    "transcriptMarkdownPath": "state/runs/run_rec_1773490216_7b166148_mmvg4vsyc805/transcript.md",
    "chaptersPath": "state/runs/run_rec_1773490216_7b166148_mmvg4vsyc805/chapters.json",
    "transcriptMarkdownRole": "human_readable_transcript"
  }
}
